{
  "schemaVersion": 1,
  "owner": "saved_data",
  "version": 1,
  "settings": [
    {
      "key": "waypoints.limit",
      "title": "Waypoint limit",
      "description": "How many waypoints one world's state keeps.",
      "valueSchema": { "type": "integer", "minimum": 1, "maximum": 64 },
      "default": 8,
      "side": "integrated-server",
      "restartRequired": false
    }
  ]
}
